{
  "$schema": "https://json-schema.org/draft/2020-12/schema",
  "$id": "https://raw.githubusercontent.com/mlechner911/mdviewer/main/mlcext/mlc-template.schema.json",
  "title": "MarkSafe document template",
  "description": "Template for new documents: input fields for the form, a Markdown body with {{placeholders}} and the output file name. Placeholders: {{id}}, {{id|yaml}} (YAML-safe scalar), {{id|list}} (YAML list, for multiselect) and {{id|ref}} (docref: \"ID (Titel)\"). Fields with \"target\": \"frontmatter\" are written into the front matter. For documents of the MLC Markdown Extension (category \"mlc\") id, version and title live there (doc_id, version, title); the body uses the document variables {{doc_id}}, {{version}}, {{title}}, which stay in the file.",
  "type": "object",
  "additionalProperties": false,
  "required": [
    "name",
    "body",
    "fields"
  ],
  "properties": {
    "$schema": {
      "type": "string"
    },
    "name": {
      "type": "string",
      "minLength": 1,
      "description": "Name in the template list."
    },
    "description": {
      "type": "string"
    },
    "body": {
      "type": "string",
      "minLength": 1,
      "description": "Markdown file next to this schema, with the document text."
    },
    "file": {
      "type": "string",
      "description": "Suggested output file name, with placeholders, e.g. \"{{doc_id}}.md\"."
    },
    "category": {
      "enum": [
        "mlc",
        "general"
      ],
      "description": "Group in the dialog: documents of the MLC Markdown Extension or general Markdown. Default: mlc when a field writes doc_id or is a refno."
    },
    "fields": {
      "type": "array",
      "items": {
        "$ref": "#/$defs/field"
      }
    }
  },
  "$defs": {
    "field": {
      "type": "object",
      "additionalProperties": false,
      "required": [
        "id",
        "label",
        "type"
      ],
      "properties": {
        "id": {
          "type": "string",
          "pattern": "^[a-z][a-z0-9_]*$",
          "description": "Name of the placeholder {{id}}, or the front matter key with target \"frontmatter\"."
        },
        "label": {
          "type": "string",
          "minLength": 1
        },
        "type": {
          "enum": [
            "text",
            "multiline",
            "number",
            "date",
            "time",
            "hour",
            "select",
            "multiselect",
            "refno",
            "docref"
          ],
          "description": "hour is the same as time (HH:MM)."
        },
        "required": {
          "type": "boolean"
        },
        "default": {
          "description": "Preset value; a list for multiselect.",
          "type": [
            "string",
            "number",
            "array"
          ]
        },
        "help": {
          "type": "string"
        },
        "placeholder": {
          "type": "string"
        },
        "options": {
          "description": "Choices for select/multiselect: a list, or the name of a shared list (event_kinds).",
          "oneOf": [
            {
              "type": "array",
              "items": {
                "type": "string"
              },
              "minItems": 1
            },
            {
              "enum": [
                "event_kinds"
              ]
            }
          ]
        },
        "prefix": {
          "type": "string",
          "description": "refno: prefix of the document ID, e.g. FB. docref: only documents with this prefix."
        },
        "area": {
          "type": "string",
          "description": "refno: id of the field holding the area (QM, KAL …) for the suggestion."
        },
        "min": {
          "type": "number"
        },
        "max": {
          "type": "number"
        },
        "step": {
          "type": "number",
          "exclusiveMinimum": 0
        },
        "format": {
          "enum": [
            "TT.MM.JJJJ",
            "JJJJ-MM-TT"
          ],
          "description": "date: output format (default TT.MM.JJJJ)."
        },
        "multiple": {
          "type": "boolean",
          "description": "docref: several documents may be chosen."
        },
        "target": {
          "const": "frontmatter",
          "description": "The value goes into the front matter under the field id (MLC documents: doc_id, version, title, description, event_kinds) instead of a placeholder."
        }
      },
      "allOf": [
        {
          "if": {
            "properties": {
              "type": {
                "enum": [
                  "select",
                  "multiselect"
                ]
              }
            }
          },
          "then": {
            "required": [
              "options"
            ]
          }
        },
        {
          "if": {
            "properties": {
              "type": {
                "const": "refno"
              }
            }
          },
          "then": {
            "required": [
              "prefix"
            ]
          }
        }
      ]
    }
  }
}
